[
  {
    "record_id": 1001,
    "db_id": "orchestra",
    "nl_queries": {
      "canonical": "For each conductor, calculate the moving average of attendance across their last three performances (ordered by Performance_ID), treating missing attendance as 0. Then, find the median of these final moving averages across all conductors. Return the names and final moving averages of conductors whose final moving average is above the median.",
      "colloquial": "Which conductors have above-median attendance in their latest three performances?"
    },
    "MQL": "db.conductor.aggregate([\n  {\n    \"$unwind\": {\n      \"path\": \"$orchestra\",\n      \"preserveNullAndEmptyArrays\": false\n    }\n  },\n  {\n    \"$unwind\": {\n      \"path\": \"$orchestra.performance\",\n      \"preserveNullAndEmptyArrays\": false\n    }\n  },\n  {\n    \"$setWindowFields\": {\n      \"partitionBy\": \"$_id\",\n      \"sortBy\": {\n        \"orchestra.performance.Performance_ID\": 1\n      },\n      \"output\": {\n        \"moving_avg_attendance\": {\n          \"$avg\": {\n            \"$ifNull\": [\n              \"$orchestra.performance.Attendance\",\n              0\n            ]\n          },\n          \"window\": {\n            \"documents\": [\n              -2,\n              0\n            ]\n          }\n        }\n      }\n    }\n  },\n  {\n    \"$group\": {\n      \"_id\": \"$_id\",\n      \"Name\": {\n        \"$first\": {\n          \"$ifNull\": [\n            \"$Name\",\n            \"(unknown)\"\n          ]\n        }\n      },\n      \"last_window_avg\": {\n        \"$last\": \"$moving_avg_attendance\"\n      }\n    }\n  },\n  {\n    \"$facet\": {\n      \"per_conductor\": [\n        {\n          \"$project\": {\n            \"_id\": 0,\n            \"Name\": 1,\n            \"last_window_avg\": 1\n          }\n        }\n      ],\n      \"global_median\": [\n        {\n          \"$sort\": {\n            \"last_window_avg\": 1\n          }\n        },\n        {\n          \"$group\": {\n            \"_id\": null,\n            \"vals\": {\n              \"$push\": \"$last_window_avg\"\n            }\n          }\n        },\n        {\n          \"$project\": {\n            \"_id\": 0,\n            \"median\": {\n              \"$arrayElemAt\": [\n                \"$vals\",\n                {\n                  \"$floor\": {\n                    \"$divide\": [\n                      {\n                        \"$size\": \"$vals\"\n                      },\n                      2\n                    ]\n                  }\n                }\n              ]\n            }\n          }\n        }\n      ]\n    }\n  },\n  {\n    \"$project\": {\n      \"kept\": {\n        \"$filter\": {\n          \"input\": \"$per_conductor\",\n          \"as\": \"c\",\n          \"cond\": {\n            \"$gt\": [\n              \"$$c.last_window_avg\",\n              {\n                \"$arrayElemAt\": [\n                  \"$global_median.median\",\n                  0\n                ]\n              }\n            ]\n          }\n        }\n      }\n    }\n  },\n  {\n    \"$unwind\": \"$kept\"\n  },\n  {\n    \"$project\": {\n      \"_id\": 0,\n      \"Name\": \"$kept.Name\",\n      \"last_window_avg\": \"$kept.last_window_avg\"\n    }\n  }\n])",
    "canonical_form_set": {
      "must_contain": [
        "$facet",
        "$ifNull",
        "$setWindowFields"
      ],
      "must_not_contain": [
        "$function",
        "$merge",
        "$out",
        "$rand",
        "$sample"
      ],
      "must_contain_at_root": [
        "$facet",
        "$setWindowFields"
      ],
      "must_not_contain_at_root": []
    },
    "difficulty": "L4",
    "sql_infeasibility_class": "structural_pipeline",
    "schema_flex": "none",
    "shape_policy": "reshape",
    "world_signature": "sha256:52087da4c35c009f6604a9f5021121c61274383dbcaa4c52b59d1a140522befb",
    "domain_id": "orchestra",
    "join_depth": 0,
    "aggregation_depth": "deep",
    "schema_pattern": "embed",
    "agent_design_rationale_ref": "agent_design_rationale/orchestra.yaml",
    "property_verification_ref": "audit/orchestra/1001/pv.yaml",
    "round_trip_ref": "audit/orchestra/1001/rtv.yaml",
    "_diagnostic_bridge_ref": "audit/orchestra/1001/nnc.yaml",
    "mutations_ref": "audit/orchestra/1001/mutations.json"
  },
  {
    "record_id": 1002,
    "db_id": "orchestra",
    "nl_queries": {
      "canonical": "Which conductors have a moving average attendance (over their last three performances, with missing attendance treated as 0) that is greater than the median moving average attendance across all conductors?",
      "colloquial": "Which conductors are above the median in terms of recent attendance?"
    },
    "MQL": "db.conductor.aggregate([\n  {\n    \"$unwind\": {\n      \"path\": \"$orchestra\",\n      \"preserveNullAndEmptyArrays\": false\n    }\n  },\n  {\n    \"$unwind\": {\n      \"path\": \"$orchestra.performance\",\n      \"preserveNullAndEmptyArrays\": false\n    }\n  },\n  {\n    \"$setWindowFields\": {\n      \"partitionBy\": \"$_id\",\n      \"sortBy\": {\n        \"orchestra.performance.Performance_ID\": 1\n      },\n      \"output\": {\n        \"moving_avg_attendance\": {\n          \"$avg\": {\n            \"$ifNull\": [\n              \"$orchestra.performance.Attendance\",\n              0\n            ]\n          },\n          \"window\": {\n            \"documents\": [\n              -2,\n              0\n            ]\n          }\n        }\n      }\n    }\n  },\n  {\n    \"$group\": {\n      \"_id\": \"$_id\",\n      \"Name\": {\n        \"$first\": {\n          \"$ifNull\": [\n            \"$Name\",\n            \"(unknown)\"\n          ]\n        }\n      },\n      \"last_window_avg\": {\n        \"$last\": \"$moving_avg_attendance\"\n      }\n    }\n  },\n  {\n    \"$facet\": {\n      \"per_conductor\": [\n        {\n          \"$project\": {\n            \"_id\": 0,\n            \"Name\": 1,\n            \"last_window_avg\": 1\n          }\n        }\n      ],\n      \"global_median\": [\n        {\n          \"$sort\": {\n            \"last_window_avg\": 1\n          }\n        },\n        {\n          \"$group\": {\n            \"_id\": null,\n            \"vals\": {\n              \"$push\": \"$last_window_avg\"\n            }\n          }\n        },\n        {\n          \"$project\": {\n            \"_id\": 0,\n            \"median\": {\n              \"$arrayElemAt\": [\n                \"$vals\",\n                {\n                  \"$floor\": {\n                    \"$divide\": [\n                      {\n                        \"$size\": \"$vals\"\n                      },\n                      2\n                    ]\n                  }\n                }\n              ]\n            }\n          }\n        }\n      ]\n    }\n  },\n  {\n    \"$project\": {\n      \"kept\": {\n        \"$filter\": {\n          \"input\": \"$per_conductor\",\n          \"as\": \"c\",\n          \"cond\": {\n            \"$gt\": [\n              \"$$c.last_window_avg\",\n              {\n                \"$arrayElemAt\": [\n                  \"$global_median.median\",\n                  0\n                ]\n              }\n            ]\n          }\n        }\n      }\n    }\n  },\n  {\n    \"$unwind\": \"$kept\"\n  },\n  {\n    \"$project\": {\n      \"_id\": 0,\n      \"Name\": \"$kept.Name\",\n      \"last_window_avg\": \"$kept.last_window_avg\"\n    }\n  }\n])",
    "canonical_form_set": {
      "must_contain": [
        "$facet",
        "$ifNull",
        "$setWindowFields"
      ],
      "must_not_contain": [
        "$function",
        "$merge",
        "$out",
        "$rand",
        "$sample"
      ],
      "must_contain_at_root": [
        "$facet",
        "$setWindowFields"
      ],
      "must_not_contain_at_root": []
    },
    "difficulty": "L4",
    "sql_infeasibility_class": "structural_pipeline",
    "schema_flex": "none",
    "shape_policy": "reshape",
    "world_signature": "sha256:52087da4c35c009f6604a9f5021121c61274383dbcaa4c52b59d1a140522befb",
    "domain_id": "orchestra",
    "join_depth": 0,
    "aggregation_depth": "deep",
    "schema_pattern": "embed",
    "agent_design_rationale_ref": "agent_design_rationale/orchestra.yaml",
    "property_verification_ref": "audit/orchestra/1002/pv.yaml",
    "round_trip_ref": "audit/orchestra/1002/rtv.yaml",
    "_diagnostic_bridge_ref": "audit/orchestra/1002/nnc.yaml",
    "mutations_ref": "audit/orchestra/1002/mutations.json"
  },
  {
    "record_id": 1004,
    "db_id": "concert_singer",
    "nl_queries": {
      "canonical": "For each concert, convert its attributes array into an object where each attribute name becomes a key and its corresponding value becomes the value, returning only that object.",
      "colloquial": "Turn the attribute list into a dictionary."
    },
    "MQL": "db.concert.aggregate([\n  {\n    \"$addFields\": {\n      \"bag_map\": {\n        \"$arrayToObject\": {\n          \"$map\": {\n            \"input\": \"$attributes\",\n            \"as\": \"a\",\n            \"in\": {\n              \"k\": \"$$a.name\",\n              \"v\": \"$$a.value\"\n            }\n          }\n        }\n      }\n    }\n  },\n  {\n    \"$project\": {\n      \"_id\": 0,\n      \"bag_map\": 1\n    }\n  }\n])",
    "canonical_form_set": {
      "must_contain": [
        "$arrayToObject",
        "$map"
      ],
      "must_not_contain": [
        "$function",
        "$merge",
        "$out",
        "$rand",
        "$sample"
      ],
      "must_contain_at_root": [
        "$addFields"
      ],
      "must_not_contain_at_root": []
    },
    "difficulty": "L4",
    "sql_infeasibility_class": "structural_schema_flex",
    "schema_flex": "attribute_bag",
    "shape_policy": "reshape",
    "world_signature": "sha256:d30ef9584805d89bc7ce61d5e6e7217e79cab291ccef1c5c6fe3356fe651095b",
    "domain_id": "concert",
    "join_depth": 0,